adjusted_gross_profit,q1_2022,q2_2022,q3_2022,q4_2022,q1_2023,q2_2023,q3_2023,q4_2023,q1_2024
Gross profit (millions dollars),662,686,714,762,921,951,962,1026,1129
Add: Depreciation and amortization related to cost of revenue,31,42,56,42,45,47,46,48,54
Add: Stock-based compensation expense and certain payroll tax expense included in cost of revenue,12,31,29,31,24,43,37,36,33
Add: Allocated overhead included in cost of revenue and sales and marketing,9,8,7,8,9,8,8,7,8
Add: Inventory write-off related to restructuring,0,2,0,0,0,0,0,0,0
Adjusted Gross Profit,714,769,806,843,999,1049,1053,1117,1224
Adjusted Gross Margin (percentages),0.49,0.478,0.474,0.464,0.491,0.492,0.487,0.485,0.487
